smartctl 7.5 (build date Jan  1 1980) [x86_64-linux-6.18.49] (local build)
Copyright (C) 2002-25, Bruce Allen, Christian Franke, www.smartmontools.org

=== START OF INFORMATION SECTION ===
Device Model:     OOS18000G
Serial Number:    00009FQ4
LU WWN Device Id: 5 000c50 0e3754a20
Firmware Version: OOS1
User Capacity:    18.000.207.937.536 bytes [18,0 TB]
Sector Sizes:     512 bytes logical, 4096 bytes physical
Rotation Rate:    7200 rpm
Form Factor:      3.5 inches
Device is:        Not in smartctl database 7.5/6061
ATA Version is:   ACS-4 (minor revision not indicated)
SATA Version is:  SATA 3.3, 6.0 Gb/s (current: 6.0 Gb/s)
Local Time is:    Wed Sep  9 21:50:33 2026 WEST
SMART support is: Available - device has SMART capability.
SMART support is: Enabled
AAM feature is:   Unavailable
APM feature is:   Unavailable
Rd look-ahead is: Enabled
Write cache is:   Enabled
DSN feature is:   Disabled
ATA Security is:  Disabled, frozen [SEC2]

=== START OF READ SMART DATA SECTION ===
SMART overall-health self-assessment test result: PASSED

General SMART Values:
Offline data collection status:  (0x82)	Offline data collection activity
					was completed without error.
					Auto Offline Data Collection: Enabled.
Self-test execution status:      (   0)	The previous self-test routine completed
					without error or no self-test has ever 
					been run.
Total time to complete Offline 
data collection: 		(  559) seconds.
Offline data collection
capabilities: 			 (0x7b) SMART execute Offline immediate.
					Auto Offline data collection on/off support.
					Suspend Offline collection upon new
					command.
					Offline surface scan supported.
					Self-test supported.
					Conveyance Self-test supported.
					Selective Self-test supported.
SMART capabilities:            (0x0003)	Saves SMART data before entering
					power-saving mode.
					Supports SMART auto save timer.
Error logging capability:        (0x01)	Error logging supported.
					General Purpose Logging supported.
Short self-test routine 
recommended polling time: 	 (   1) minutes.
Extended self-test routine
recommended polling time: 	 (1534) minutes.
Conveyance self-test routine
recommended polling time: 	 (   2) minutes.
SCT capabilities: 	       (0x70bd)	SCT Status supported.
					SCT Error Recovery Control supported.
					SCT Feature Control supported.
					SCT Data Table supported.

SMART Attributes Data Structure revision number: 10
Vendor Specific SMART Attributes with Thresholds:
ID# ATTRIBUTE_NAME          FLAGS    VALUE WORST THRESH FAIL RAW_VALUE
  1 Raw_Read_Error_Rate     POSR--   069   064   044    -    7555320
  3 Spin_Up_Time            PO----   092   092   000    -    0
  4 Start_Stop_Count        -O--CK   100   100   020    -    8
  5 Reallocated_Sector_Ct   PO--CK   100   100   010    -    0
  7 Seek_Error_Rate         POSR--   074   060   045    -    23164709
  9 Power_On_Hours          -O--CK   100   100   000    -    106
 10 Spin_Retry_Count        PO--C-   100   100   097    -    0
 12 Power_Cycle_Count       -O--CK   100   100   020    -    6
 18 Unknown_Attribute       PO-R--   100   100   050    -    0
187 Reported_Uncorrect      -O--CK   100   100   000    -    0
188 Command_Timeout         -O--CK   100   100   000    -    0
190 Airflow_Temperature_Cel -O---K   056   052   000    -    44 (Min/Max 29/48)
192 Power-Off_Retract_Count -O--CK   100   100   000    -    4
193 Load_Cycle_Count        -O--CK   100   100   000    -    21
194 Temperature_Celsius     -O---K   044   048   000    -    44 (0 27 0 0 0)
197 Current_Pending_Sector  -O--C-   100   100   000    -    0
198 Offline_Uncorrectable   ----C-   100   100   000    -    0
199 UDMA_CRC_Error_Count    -OSRCK   200   200   000    -    0
200 Multi_Zone_Error_Rate   PO---K   100   100   001    -    0
240 Head_Flying_Hours       ------   100   100   000    -    100 (50 206 0)
241 Total_LBAs_Written      ------   100   253   000    -    42023265360
242 Total_LBAs_Read         ------   100   253   000    -    9918292616
                            ||||||_ K auto-keep
                            |||||__ C event count
                            ||||___ R error rate
                            |||____ S speed/performance
                            ||_____ O updated online
                            |______ P prefailure warning

General Purpose Log Directory Version 1
SMART           Log Directory Version 1 [multi-sector log support]
Address    Access  R/W   Size  Description
0x00       GPL,SL  R/O      1  Log Directory
0x01           SL  R/O      1  Summary SMART error log
0x02           SL  R/O      5  Comprehensive SMART error log
0x03       GPL     R/O      5  Ext. Comprehensive SMART error log
0x04       GPL     R/O    256  Device Statistics log
0x04       SL      R/O      8  Device Statistics log
0x06           SL  R/O      1  SMART self-test log
0x07       GPL     R/O      1  Extended self-test log
0x08       GPL     R/O      2  Power Conditions log
0x09           SL  R/W      1  Selective self-test log
0x0a       GPL     R/W      8  Device Statistics Notification
0x0c       GPL     R/O   2048  Pending Defects log
0x10       GPL     R/O      1  NCQ Command Error log
0x11       GPL     R/O      1  SATA Phy Event Counters log
0x13       GPL     R/O      1  SATA NCQ Send and Receive log
0x21       GPL     R/O      1  Write stream error log
0x22       GPL     R/O      1  Read stream error log
0x24       GPL     R/O    768  Current Device Internal Status Data log
0x2f       GPL     R/O      1  Sector Configuration log
0x30       GPL,SL  R/O      9  IDENTIFY DEVICE data log
0x80-0x9f  GPL,SL  R/W     16  Host vendor specific log
0xa1       GPL,SL  VS     160  Device vendor specific log
0xa2       GPL     VS   16320  Device vendor specific log
0xa4       GPL,SL  VS     160  Device vendor specific log
0xa6       GPL     VS     192  Device vendor specific log
0xa8-0xa9  GPL,SL  VS     136  Device vendor specific log
0xab       GPL     VS       1  Device vendor specific log
0xad       GPL     VS      16  Device vendor specific log
0xb1       GPL,SL  VS     160  Device vendor specific log
0xb6       GPL     VS    1920  Device vendor specific log
0xbe-0xbf  GPL     VS   65535  Device vendor specific log
0xc1       GPL,SL  VS       8  Device vendor specific log
0xc3       GPL,SL  VS      24  Device vendor specific log
0xc6       GPL     VS    5184  Device vendor specific log
0xc7       GPL,SL  VS       8  Device vendor specific log
0xc9       GPL,SL  VS       8  Device vendor specific log
0xca       GPL,SL  VS      16  Device vendor specific log
0xcd       GPL,SL  VS       1  Device vendor specific log
0xce       GPL     VS       1  Device vendor specific log
0xcf       GPL     VS     512  Device vendor specific log
0xd1       GPL     VS     656  Device vendor specific log
0xd2       GPL     VS   10256  Device vendor specific log
0xd4       GPL     VS    2048  Device vendor specific log
0xda       GPL,SL  VS       1  Device vendor specific log
0xe0       GPL,SL  R/W      1  SCT Command/Status
0xe1       GPL,SL  R/W      1  SCT Data Transfer

SMART Extended Comprehensive Error Log Version: 1 (5 sectors)
No Errors Logged

SMART Extended Self-test Log Version: 1 (1 sectors)
Num  Test_Description    Status                  Remaining  LifeTime(hours)  LBA_of_first_error
# 1  Extended offline    Completed without error       00%        36         -
# 2  Short offline       Completed without error       00%        13         -
# 3  Short offline       Completed without error       00%         3         -
# 4  Extended offline    Aborted by host               90%         3         -

SMART Selective self-test log data structure revision number 1
 SPAN  MIN_LBA  MAX_LBA  CURRENT_TEST_STATUS
    1        0        0  Not_testing
    2        0        0  Not_testing
    3        0        0  Not_testing
    4        0        0  Not_testing
    5        0        0  Not_testing
Selective self-test flags (0x0):
  After scanning selected spans, do NOT read-scan remainder of disk.
If Selective self-test is pending on power-up, resume after 0 minute delay.

SCT Status Version:                  3
SCT Version (vendor specific):       522 (0x020a)
Device State:                        Active (0)
Current Temperature:                    44 Celsius
Power Cycle Min/Max Temperature:     29/48 Celsius
Lifetime    Min/Max Temperature:     27/48 Celsius
Under/Over Temperature Limit Count:   0/64
SMART Status:                        0xc24f (PASSED)
Vendor specific:
00 00 00 00 00 00 00 00 00 00 00 00 00 00 00 00
00 00 00 00 02 00 00 00 00 00 00 00 00 00 00 00

SCT Temperature History Version:     2
Temperature Sampling Period:         4 minutes
Temperature Logging Interval:        59 minutes
Min/Max recommended Temperature:     10/40 Celsius
Min/Max Temperature Limit:            5/60 Celsius
Temperature History Size (Index):    128 (122)

Index    Estimated Time   Temperature Celsius
 123    2026-09-04 16:24     ?  -
 ...    ..(  3 skipped).    ..  -
 127    2026-09-04 20:20     ?  -
   0    2026-09-04 21:19    29  **********
   1    2026-09-04 22:18     ?  -
   2    2026-09-04 23:17    28  *********
   3    2026-09-05 00:16     ?  -
   4    2026-09-05 01:15    28  *********
   5    2026-09-05 02:14     ?  -
   6    2026-09-05 03:13    28  *********
   7    2026-09-05 04:12     ?  -
   8    2026-09-05 05:11    28  *********
   9    2026-09-05 06:10     ?  -
  10    2026-09-05 07:09    28  *********
  11    2026-09-05 08:08     ?  -
  12    2026-09-05 09:07    27  ********
  13    2026-09-05 10:06     ?  -
  14    2026-09-05 11:05    27  ********
  15    2026-09-05 12:04     ?  -
  16    2026-09-05 13:03    29  **********
  17    2026-09-05 14:02    37  ******************
  18    2026-09-05 15:01    46  ***************************
  19    2026-09-05 16:00    36  *****************
 ...    ..(  2 skipped).    ..  *****************
  22    2026-09-05 18:57    36  *****************
  23    2026-09-05 19:56    40  *********************
 ...    ..(  3 skipped).    ..  *********************
  27    2026-09-05 23:52    40  *********************
  28    2026-09-06 00:51    41  **********************
  29    2026-09-06 01:50    45  **************************
 ...    ..( 14 skipped).    ..  **************************
  44    2026-09-06 16:35    45  **************************
  45    2026-09-06 17:34    46  ***************************
 ...    ..(  2 skipped).    ..  ***************************
  48    2026-09-06 20:31    46  ***************************
  49    2026-09-06 21:30    45  **************************
  50    2026-09-06 22:29    45  **************************
  51    2026-09-06 23:28    45  **************************
  52    2026-09-07 00:27    41  **********************
  53    2026-09-07 01:26    40  *********************
 ...    ..(  8 skipped).    ..  *********************
  62    2026-09-07 10:17    40  *********************
  63    2026-09-07 11:16    45  **************************
  64    2026-09-07 12:15    45  **************************
  65    2026-09-07 13:14    46  ***************************
 ...    ..( 15 skipped).    ..  ***************************
  81    2026-09-08 04:58    46  ***************************
  82    2026-09-08 05:57    45  **************************
  83    2026-09-08 06:56    46  ***************************
  84    2026-09-08 07:55    45  **************************
  85    2026-09-08 08:54    46  ***************************
  86    2026-09-08 09:53    46  ***************************
  87    2026-09-08 10:52    40  *********************
  88    2026-09-08 11:51    40  *********************
  89    2026-09-08 12:50    40  *********************
  90    2026-09-08 13:49    41  **********************
  91    2026-09-08 14:48    45  **************************
  92    2026-09-08 15:47    47  ****************************
  93    2026-09-08 16:46    48  *****************************
  94    2026-09-08 17:45    48  *****************************
  95    2026-09-08 18:44    48  *****************************
  96    2026-09-08 19:43    44  *************************
  97    2026-09-08 20:42    41  **********************
  98    2026-09-08 21:41    40  *********************
 ...    ..( 17 skipped).    ..  *********************
 116    2026-09-09 15:23    40  *********************
 117    2026-09-09 16:22    41  **********************
 118    2026-09-09 17:21    43  ************************
 119    2026-09-09 18:20    45  **************************
 120    2026-09-09 19:19    45  **************************
 121    2026-09-09 20:18    44  *************************
 122    2026-09-09 21:17    44  *************************

SCT Error Recovery Control:
           Read:    100 (10,0 seconds)
          Write:    100 (10,0 seconds)

Device Statistics (GP Log 0x04)
Page  Offset Size        Value Flags Description
0x01  =====  =               =  ===  == General Statistics (rev 1) ==
0x01  0x008  4               6  ---  Lifetime Power-On Resets
0x01  0x010  4             106  ---  Power-on Hours
0x01  0x018  6     42023789648  ---  Logical Sectors Written
0x01  0x020  6       278893712  ---  Number of Write Commands
0x01  0x028  6      9918292616  ---  Logical Sectors Read
0x01  0x030  6         1213860  ---  Number of Read Commands
0x01  0x038  6               -  ---  Date and Time TimeStamp
0x03  =====  =               =  ===  == Rotating Media Statistics (rev 1) ==
0x03  0x008  4             105  ---  Spindle Motor Power-on Hours
0x03  0x010  4             100  ---  Head Flying Hours
0x03  0x018  4              21  ---  Head Load Events
0x03  0x020  4               0  ---  Number of Reallocated Logical Sectors
0x03  0x028  4               0  ---  Read Recovery Attempts
0x03  0x030  4               0  ---  Number of Mechanical Start Failures
0x03  0x038  4               0  ---  Number of Realloc. Candidate Logical Sectors
0x03  0x040  4               4  ---  Number of High Priority Unload Events
0x04  =====  =               =  ===  == General Errors Statistics (rev 1) ==
0x04  0x008  4               0  ---  Number of Reported Uncorrectable Errors
0x04  0x010  4               0  ---  Resets Between Cmd Acceptance and Completion
0x04  0x018  4               0  -D-  Physical Element Status Changed
0x05  =====  =               =  ===  == Temperature Statistics (rev 1) ==
0x05  0x008  1              44  ---  Current Temperature
0x05  0x010  1              41  ---  Average Short Term Temperature
0x05  0x018  1               -  ---  Average Long Term Temperature
0x05  0x020  1              48  ---  Highest Temperature
0x05  0x028  1              34  ---  Lowest Temperature
0x05  0x030  1              45  ---  Highest Average Short Term Temperature
0x05  0x038  1              41  ---  Lowest Average Short Term Temperature
0x05  0x040  1               -  ---  Highest Average Long Term Temperature
0x05  0x048  1               -  ---  Lowest Average Long Term Temperature
0x05  0x050  4               0  ---  Time in Over-Temperature
0x05  0x058  1              60  ---  Specified Maximum Operating Temperature
0x05  0x060  4               0  ---  Time in Under-Temperature
0x05  0x068  1               5  ---  Specified Minimum Operating Temperature
0x06  =====  =               =  ===  == Transport Statistics (rev 1) ==
0x06  0x008  4              11  ---  Number of Hardware Resets
0x06  0x010  4               0  ---  Number of ASR Events
0x06  0x018  4               0  ---  Number of Interface CRC Errors
0xff  =====  =               =  ===  == Vendor Specific Statistics (rev 1) ==
0xff  0x008  7               0  ---  Vendor Specific
0xff  0x010  7               0  ---  Vendor Specific
0xff  0x018  7               0  ---  Vendor Specific
                                |||_ C monitored condition met
                                ||__ D supports DSN
                                |___ N normalized value

Pending Defects log (GP Log 0x0c)
No Defects Logged

SATA Phy Event Counters (GP Log 0x11)
ID      Size     Value  Description
0x000a  2           12  Device-to-host register FISes sent due to a COMRESET
0x0001  2            0  Command failed due to ICRC error
0x0003  2            0  R_ERR response for device-to-host data FIS
0x0004  2            0  R_ERR response for host-to-device data FIS
0x0006  2            0  R_ERR response for device-to-host non-data FIS
0x0007  2            0  R_ERR response for host-to-device non-data FIS

